Symbol,Name,Last Sale,Net Change,% Change,Market Cap,Country,IPO Year,Volume,Sector,Industry
DG,Dollar General Corporation Common Stock,$102.77,0.78,0.765%,22620296498.00,United States,2009,2659037,Consumer Discretionary,Department/Specialty Retail Stores
DGICA,Donegal Group Inc. Class A Common Stock,$19.27,0.16,0.837%,703521281.00,United States,,110980,Finance,Property-Casualty Insurers
DGICB,Donegal Group Inc. Class B Common Stock,$15.33,-0.38,-2.419%,559677283.00,United States,1986,438,Finance,Property-Casualty Insurers
DGII,Digi International Inc. Common Stock,$38.30,-0.52,-1.34%,1421779571.00,United States,1989,108503,Telecommunications,Computer Communications Equipment
DGLY,Digital Ally Inc. Common Stock,$1.85,0.00,0.00%,3195729.00,United States,,12327,Technology,Radio And Television Broadcasting And Communications Equipment
DGNX,Diginex Limited Ordinary Shares,$15.76,1.76,12.571%,3182733639.00,Hong Kong,2025,980522,Technology,EDP Services
DGX,Quest Diagnostics Incorporated Common Stock,$180.26,-1.92,-1.054%,20157293475.00,United States,,900956,Health Care,Medical Specialities
DGXX,Digi Power X Inc. Subordinate Voting Shares,$5.77,1.18,25.708%,264439660.00,Canada,,15898548,Finance,Finance: Consumer Services
DH,Definitive Healthcare Corp. Class A Common Stock,$2.97,0.00,0.00%,309136044.00,United States,2021,216655,Technology,Computer Software: Prepackaged Software
DHAI,DIH Holdings US Inc. Class A Common Stock,$2.71,0.00,0.00%,5671090.00,United States,2024,52593,Health Care,Medical/Dental Instruments
DHAIW,DIH Holding US Inc. Warrants,$0.0139,0.0005,3.731%,29088.00,United States,2024,26683,Health Care,Medical/Dental Instruments
DHC,Diversified Healthcare Trust Common Shares of Beneficial Interest,$4.14,-0.15,-3.497%,999455438.00,United States,,382133,Real Estate,Real Estate Investment Trusts
DHCNI,Diversified Healthcare Trust 5.625% Senior Notes due 2042,$16.75,-0.33,-1.932%,4043690480.00,United States,,3029,Real Estate,Real Estate Investment Trusts
DHCNL,Diversified Healthcare Trust 6.25% Senior Notes Due 2046,$17.92,-0.03,-0.167%,4326145277.00,United States,,23833,Real Estate,Real Estate Investment Trusts
DHF,BNY Mellon High Yield Strategies Fund Common Stock,$2.58,0.01,0.389%,0.00,United States,1998,134578,Finance,Finance Companies
DHI,D.R. Horton Inc. Common Stock,$158.86,0.91,0.576%,47359903817.00,United States,,2904779,Consumer Discretionary,Homebuilding
DHIL,Diamond Hill Investment Group Inc. Class A Common Stock,$137.70,0.20,0.145%,375254257.00,United States,,17278,Finance,Investment Managers
DHR,Danaher Corporation Common Stock,$221.01,-2.00,-0.897%,158254561906.00,United States,,3454906,Industrials,Industrial Machinery/Components
DHT,DHT Holdings Inc.,$12.73,0.23,1.84%,2043903060.00,Jersey,2005,1612896,Consumer Discretionary,Marine Transportation
DHX,DHI Group Inc. Common Stock,$2.04,-0.05,-2.392%,97941118.00,United States,2007,87021,Real Estate,Real Estate
DHY,Credit Suisse High Yield Credit Fund Common Stock,$2.08,0.00,0.00%,0.00,United States,1998,594102,Finance,Finance/Investors Services
DIAX,Nuveen Dow 30SM Dynamic Overwrite Fund Common Shares of Beneficial Interest,$14.85,0.01,0.067%,0.00,,2014,61055,Finance,Finance Companies
DIBS,1stdibs.com Inc. Common Stock,$3.43,0.16,4.893%,124325869.00,United States,2021,147520,Consumer Discretionary,Catalog/Specialty Distribution
DIN,Dine Brands Global Inc. Common Stock,$26.88,-0.85,-3.065%,413396202.00,United States,,310385,Consumer Discretionary,Restaurants
DINO,HF Sinclair Corporation Common Stock,$54.74,0.20,0.367%,10240789800.00,United States,1960,1424313,Energy,Natural Gas Distribution
DIOD,Diodes Incorporated Common Stock,$56.63,-0.42,-0.736%,2630052083.00,United States,,202676,Technology,Semiconductors
DIS,Walt Disney Company (The) Common Stock,$112.34,0.66,0.591%,201979886799.00,United States,,6029584,Consumer Discretionary,Services-Misc. Amusement & Recreation
DIT,AMCON Distributing Company Common Stock,$114.00,-2.50,-2.146%,73582668.00,United States,1999,1109,Consumer Discretionary,Food Distributors
DJCO,Daily Journal Corp. (S.C.) Common Stock,$374.53,-42.38,-10.165%,515887360.00,United States,,393549,Consumer Discretionary,Newspapers/Magazines
DJT,Trump Media & Technology Group Corp. Common Stock,$16.03,0.19,1.199%,4441390358.00,United States,2024,4037156,Technology,Computer Software: Programming Data Processing
DJTWW,Trump Media & Technology Group Corp. Warrants,$6.63,-0.17,-2.50%,1836956835.00,United States,2021,81345,Technology,Computer Software: Programming Data Processing
DK,Delek US Holdings Inc. Common Stock,$37.85,0.45,1.203%,2276768605.00,United States,2017,745100,Energy,Integrated oil Companies
DKI,DarkIris Inc. Class A Ordinary Shares,$0.6635,-0.0075,-1.118%,11611250.00,Hong Kong,2025,127386,Technology,Computer Software: Prepackaged Software
DKL,Delek Logistics Partners L.P. Common Units representing Limited Partner Interests,$45.39,0.09,0.199%,2426723198.00,United States,2012,45592,Energy,Natural Gas Distribution
DKNG,DraftKings Inc. Class A Common Stock,$32.96,-0.04,-0.121%,16363653540.00,United States,2019,18139358,Consumer Discretionary,Services-Misc. Amusement & Recreation
DKS,Dick's Sporting Goods Inc Common Stock,$229.27,3.89,1.726%,18363766511.00,United States,2002,932076,Consumer Discretionary,Other Specialty Stores
DLB,Dolby Laboratories Common Stock,$67.60,0.24,0.356%,6479066906.00,United States,2005,410685,Miscellaneous,Multi-Sector Companies
DLHC,DLH Holdings Corp.,$5.77,0.02,0.348%,83009920.00,United States,,6707,Consumer Discretionary,Professional Services
DLNG,Dynagas LNG Partners LP Common Units,$3.59,0.05,1.412%,131673237.00,Greece,,45861,Consumer Discretionary,Marine Transportation
DLNG^A,Dynagas LNG Partners LP 9.00% Series A Cumulative Redeemable Preferred Units,$26.15,-0.13,-0.495%,,Greece,,1009,,
DLO,DLocal Limited Class A Common Shares,$15.38,0.25,1.652%,4390607592.00,Uruguay,2021,1446483,Real Estate,Real Estate
DLPN,Dolphin Entertainment Inc. Common Stock,$1.76,0.15,9.317%,20658394.00,United States,,66993,Consumer Discretionary,Other Consumer Services
DLR,Digital Realty Trust Inc. Common Stock,$178.14,-1.14,-0.636%,60754724491.00,United States,2004,2104031,Real Estate,Real Estate Investment Trusts
DLR^J,Digital Realty Trust Inc. 5.250% Series J Cumulative Redeemable Preferred Stock,$23.00,0.10,0.437%,,United States,,14257,,
DLR^K,Digital Realty Trust Inc. 5.850% Series K Cumulative Redeemable Preferred Stock par value $0.01 per share,$24.53,0.19,0.781%,,United States,,18914,,
DLR^L,Digital Realty Trust Inc. 5.200% Series L Cumulative Redeemable Preferred Stock,$22.59,0.10,0.445%,,United States,,18031,,
DLTH,Duluth Holdings Inc. Class B Common Stock,$3.12,-0.04,-1.266%,114478347.00,United States,2015,45894,Consumer Discretionary,Clothing/Shoe/Accessory Stores
DLTR,Dollar Tree Inc. Common Stock,$102.59,3.54,3.574%,20925060911.00,United States,1995,4854898,Consumer Discretionary,Department/Specialty Retail Stores
DLX,Deluxe Corporation Common Stock,$18.88,-0.45,-2.328%,847433426.00,United States,,237406,Consumer Discretionary,Publishing
DLXY,Delixy Holdings Limited Ordinary Shares,$0.9062,-0.0019,-0.209%,14816370.00,Singapore,2025,93432,Energy,Oil Refining/Marketing
DLY,DoubleLine Yield Opportunities Fund Common Shares of Beneficial Interest,$14.79,-0.06,-0.404%,709118071.00,United States,2020,283319,Finance,Investment Managers
DMA,Destra Multi-Alternative Fund Common Stock,$8.69,0.07,0.812%,0.00,,2022,25496,Finance,Trusts Except Educational Religious and Charitable
DMAA,Drugs Made In America Acquisition Corp. Ordinary Shares,$10.32,0.005,0.048%,0.00,United States,2025,41107,,
DMAAR,Drugs Made In America Acquisition Corp. Rights,$0.1811,0.0015,0.835%,0.00,United States,2025,3237,Finance,Blank Checks
DMAAU,Drugs Made In America Acquisition Corp. Units,$10.4862,0.0362,0.346%,0.00,United States,2025,499,,
DMAC,DiaMedica Therapeutics Inc. Common Stock,$6.88,0.00,0.00%,355619721.00,United States,2018,269320,Health Care,Biotechnology: Pharmaceutical Preparations
DMB,BNY Mellon Municipal Bond Infrastructure Fund Inc. Common Stock,$10.81,0.00,0.00%,0.00,,2013,44010,Finance,Trusts Except Educational Religious and Charitable
DMIIU,Drugs Made In America Acquisition II Corp. Unit,$10.015,0.01,0.10%,0.00,United States,2025,283966,,
DMLP,Dorchester Minerals L.P. Common Units Representing Limited Partnership Interests,$25.26,-0.05,-0.198%,1195802237.00,United States,,86767,Energy,Oil & Gas Production
DMO,Western Asset Mortgage Opportunity Fund Inc. Common Stock,$11.895,-0.025,-0.21%,0.00,United States,2010,49365,Finance,Trusts Except Educational Religious and Charitable
DMRC,Digimarc Corporation Common Stock,$9.77,-0.33,-3.267%,211827063.00,United States,,91494,Technology,EDP Services
DNA,Ginkgo Bioworks Holdings Inc. Class A Common Stock,$13.39,-0.18,-1.326%,792684693.00,United States,2021,1016845,Health Care,Biotechnology: Biological Products (No Diagnostic Substances)
DNLI,Denali Therapeutics Inc. Common Stock,$16.21,0.25,1.566%,2370101026.00,United States,2017,1488747,Health Care,Biotechnology: Biological Products (No Diagnostic Substances)
DNN,Denison Mines Corp Ordinary Shares (Canada),$2.78,-0.03,-1.068%,2492416995.00,Canada,,64935259,Basic Materials,Other Metals and Minerals
DNOW,DNOW Inc. Common Stock,$14.69,-0.59,-3.861%,1542625781.00,United States,2014,1288264,Consumer Discretionary,Oil and Gas Field Machinery
DNP,DNP Select Income Fund Inc. Common Stock,$10.17,-0.06,-0.587%,0.00,United States,1987,710796,Finance,Investment Managers
DNTH,Dianthus Therapeutics Inc. Common Stock,$33.52,0.60,1.823%,1078953324.00,United States,2018,720273,Health Care,Biotechnology: Pharmaceutical Preparations
DNUT,Krispy Kreme Inc. Common Stock,$4.16,0.18,4.523%,712192000.00,United States,2021,11174877,Consumer Staples,Food Chains
DOC,Healthpeak Properties Inc. Common Stock,$19.06,0.30,1.599%,13245743626.00,United States,,9167439,Real Estate,Real Estate Investment Trusts
DOCN,DigitalOcean Holdings Inc. Common Stock,$40.38,0.93,2.357%,3676094169.00,United States,2021,1793354,Technology,Computer Software: Programming Data Processing
DOCS,Doximity Inc. Class A Common Stock,$68.50,1.66,2.484%,12830012942.00,United States,2021,1754063,Technology,EDP Services
DOCU,DocuSign Inc. Common Stock,$71.44,-0.05,-0.07%,14366878118.00,United States,1989,1677858,Technology,Computer Software: Prepackaged Software
DOGZ,Dogness (International) Corporation Class A Common Stock,$11.76,-0.25,-2.082%,167705338.00,China,2017,79757,Consumer Discretionary,Miscellaneous manufacturing industries
DOLE,Dole plc Ordinary Shares,$12.84,-0.04,-0.311%,1221572357.00,Ireland,2021,636283,Consumer Staples,Farming/Seeds/Milling
DOMH,Dominari Holdings Inc. Common Stock,$6.06,0.20,3.413%,92829734.00,United States,,128543,Health Care,Biotechnology: Pharmaceutical Preparations
DOMO,Domo Inc. Class B Common Stock,$13.95,0.28,2.048%,575175603.00,United States,2018,750044,Technology,Computer Software: Prepackaged Software
DOOO,BRP Inc. (Recreational Products) Common Subordinate Voting Shares,$66.71,-0.55,-0.818%,4872570714.00,Canada,,78832,Consumer Discretionary,Industrial Specialties
DORM,Dorman Products Inc. Common Stock,$153.75,-4.28,-2.708%,4694639861.00,United States,,833148,Consumer Discretionary,Auto Parts:O.E.M.
DOUG,Douglas Elliman Inc. Common Stock,$2.77,0.05,1.838%,245721440.00,United States,2021,389362,Finance,Real Estate
DOV,Dover Corporation Common Stock,$177.96,0.53,0.299%,24407787565.00,United States,,1172302,Industrials,Industrial Machinery/Components
DOW,Dow Inc. Common Stock ,$25.73,0.92,3.708%,18288044996.00,United States,2019,17744703,Industrials,Major Chemicals
DOX,Amdocs Limited Ordinary Shares,$84.27,0.85,1.019%,9513287828.00,Guernsey,,937971,Technology,EDP Services
DOYU,DouYu International Holdings Limited ADS,$6.99,-0.15,-2.101%,210950224.00,China,2019,27618,Technology,Computer Software: Programming Data Processing
DPG,Duff & Phelps Utility and Infrastructure Fund Inc.,$13.31,0.01,0.075%,0.00,United States,2011,53784,Finance,Trusts Except Educational Religious and Charitable
DPRO,Draganfly Inc. Common Shares,$9.53,0.09,0.953%,211912282.00,Canada,,3671818,Industrials,Aerospace
DPZ,Domino's Pizza Inc Common Stock,$412.70,-2.16,-0.521%,13943572169.00,United States,2004,554938,Consumer Discretionary,Food Distributors
DQ,DAQO New Energy Corp. American Depositary Shares each representing five ordinary shares,$29.69,3.66,14.061%,1990913868.00,China,2010,2022832,Technology,Semiconductors
DRCT,Direct Digital Holdings Inc. Class A Common Stock,$0.3402,-0.0131,-3.708%,7660415.00,United States,2022,616668,Consumer Discretionary,Advertising
DRD,DRDGOLD Limited American Depositary Shares,$23.81,-1.34,-5.328%,2058585719.00,South Africa,,866664,Basic Materials,Precious Metals
DRDB,Roman DBDR Acquisition Corp. II Ordinary shares,$10.42,-0.03,-0.287%,0.00,United States,2025,26425,,
DRDBU,Roman DBDR Acquisition Corp. II Unit,$10.67,0.00,0.00%,0.00,United States,2024,1,,
DRDBW,Roman DBDR Acquisition Corp. II Warrants,$0.70,-0.0568,-7.505%,0.00,United States,2025,1583,,
DRH,Diamondrock Hospitality Company Common Stock,$7.82,0.02,0.256%,1602744894.00,United States,2005,2024437,Real Estate,Real Estate Investment Trusts
DRH^A,Diamondrock Hospitality Company 8.250% Series A Cumulative Redeemable Preferred Stock,$25.30,0.0101,0.04%,,United States,,4366,,
DRI,Darden Restaurants Inc. Common Stock,$183.63,-1.19,-0.644%,21358696116.00,United States,,1037177,Consumer Discretionary,Restaurants
DRIO,DarioHealth Corp. Common Stock,$15.75,-0.44,-2.718%,106614648.00,Israel,,35828,Health Care,Medical/Dental Instruments
DRMA,Dermata Therapeutics Inc. Common Stock,$4.07,0.063,1.572%,2773937.00,United States,2021,36876,Health Care,Biotechnology: Pharmaceutical Preparations
DRS,Leonardo DRS Inc. Common Stock,$41.31,0.80,1.975%,10993567321.00,Israel,,1034028,Industrials,Industrial Machinery/Components
DRTS,Alpha Tau Medical Ltd. Ordinary Shares,$4.16,-0.07,-1.655%,292783171.00,Israel,,128669,Health Care,Medical/Dental Instruments
DRTSW,Alpha Tau Medical Ltd. Warrant,$0.39,0.0522,15.453%,27448422.00,Israel,,3600,Health Care,Medical/Dental Instruments
DRUG,Bright Minds Biosciences Inc. Common Stock,$58.78,-2.40,-3.923%,416435080.00,Canada,,260973,Health Care,Biotechnology: Pharmaceutical Preparations
DRVN,Driven Brands Holdings Inc. Common Stock,$15.235,-0.065,-0.425%,2502805053.00,United States,2021,981332,Consumer Discretionary,Automotive Aftermarket
DSGN,Design Therapeutics Inc. Common Stock,$6.97,1.24,21.64%,396928438.00,United States,2021,329917,Health Care,Biotechnology: Pharmaceutical Preparations
DSGR,Distribution Solutions Group Inc. Common Stock,$29.83,-0.48,-1.584%,1380386024.00,United States,,28826,Consumer Discretionary,Industrial Specialties
DSGX,Descartes Systems Group Inc. (The) Common Stock,$95.52,-0.89,-0.923%,8208560488.00,Canada,,467655,Technology,Computer Software: Prepackaged Software
DSL,DoubleLine Income Solutions Fund Common Shares of Beneficial Interests,$11.76,-0.03,-0.254%,1199482697.00,United States,2013,797127,Finance,Trusts Except Educational Religious and Charitable
DSM,BNY Mellon Strategic Municipal Bond Fund Inc. Common Stock,$6.03,0.00,0.00%,0.00,United States,1989,78049,Finance,Investment Managers
DSP,Viant Technology Inc. Class A Common Stock,$9.08,-0.07,-0.765%,571596288.00,United States,2021,216092,Technology,Computer Software: Programming Data Processing
DSS,DSS Inc. Common Stock,$1.27,-0.01,-0.781%,11547498.00,United States,,27619,Consumer Discretionary,Containers/Packaging
DSU,Blackrock Debt Strategies Fund Inc. Common Stock,$10.33,0.04,0.389%,0.00,United States,1998,146373,Finance,Finance Companies
DSWL,Deswell Industries Inc. Common Shares,$3.51,0.08,2.332%,55932689.00,Macau,1995,11801,Industrials,Plastic Products
DSX,Diana Shipping inc. common stock,$1.68,-0.03,-1.754%,194490006.00,Greece,2005,139199,Consumer Discretionary,Marine Transportation
DSX^B,Diana Shipping Inc. Perpetual Preferred Shares Series B (Marshall Islands),$27.11,0.4643,1.742%,,Greece,,536,,
DSY,Big Tree Cloud Holdings Limited Ordinary Shares,$0.7152,0.0005,0.07%,40824006.00,China,,273631,Consumer Discretionary,Containers/Packaging
DSYWW,Big Tree Cloud Holdings Limited Warrants,$0.0228,-0.0071,-23.746%,1301436.00,China,,164402,Consumer Discretionary,Containers/Packaging
DT,Dynatrace Inc. Common Stock,$50.51,0.20,0.398%,15229080283.00,United States,2019,1596972,Technology,Computer Software: Prepackaged Software
DTB,DTE Energy Company 2020 Series G 4.375% Junior Subordinated Debentures due 2080,$18.41,0.09,0.491%,3821691453.00,United States,2020,19220,Utilities,Electric Utilities: Central
DTCK,Davis Commodities Limited Class A Ordinary Shares,$1.56,0.41,35.652%,38220975.00,Singapore,2023,5040537,Industrials,Farming/Seeds/Milling
DTE,DTE Energy Company Common Stock,$141.63,-0.21,-0.148%,29400660539.00,United States,,934102,Utilities,Electric Utilities: Central
DTF,DTF Tax-Free Income 2028 Term Fund Inc. Common Stock,$11.3369,0.0069,0.061%,79693498.00,United States,1991,20977,Finance,Investment Managers
DTG,DTE Energy Company 2021 Series E 4.375% Junior Subordinated Debentures,$18.45,0.03,0.163%,3829994965.00,United States,2021,12702,Utilities,Electric Utilities: Central
DTI,Drilling Tools International Corporation Common Stock,$2.35,-0.16,-6.375%,83804048.00,United States,2021,28094,Consumer Discretionary,Oil and Gas Field Machinery
DTIL,Precision BioSciences Inc. Common Stock,$7.18,0.46,6.845%,84630595.00,United States,2019,219629,Health Care,Biotechnology: Biological Products (No Diagnostic Substances)
DTK,DTE Energy Company 2025 Series H 6.25% Junior Subordinated Debentures due 2085,$25.19,0.04,0.159%,0.00,United States,2025,43671,Utilities,Electric Utilities: Central
DTM,DT Midstream Inc. Common Stock ,$106.54,0.93,0.881%,10823665483.00,United States,2021,924044,Utilities,Natural Gas Distribution
DTSQ,DT Cloud Star Acquisition Corporation Ordinary Shares,$10.57,0.0889,0.848%,0.00,United States,2024,278756,,
DTSQU,DT Cloud Star Acquisition Corporation Units,$10.60,0.00,0.00%,0.00,United States,2024,2,,
DTSS,Datasea Inc. Common Stock,$1.93,-0.0006,-0.031%,15935655.00,China,,30339,Technology,Computer Software: Prepackaged Software
DTST,Data Storage Corporation Common Stock,$4.27,0.047,1.113%,31010602.00,United States,,35325,Technology,EDP Services
DTSTW,Data Storage Corporation Warrant,$0.185,0.00,0.00%,1343551.00,United States,,7,Technology,EDP Services
DTW,DTE Energy Company 2017 Series E 5.25% Junior Subordinated Debentures due 2077,$22.52,0.05,0.223%,4674877324.00,United States,2017,11329,Utilities,Electric Utilities: Central
DUK,Duke Energy Corporation (Holding Company) Common Stock,$127.49,0.12,0.094%,99139343298.00,United States,,2308411,Utilities,Power Generation
DUK^A,Duke Energy Corporation Depositary Shares each representing a 1/1000th interest in a share of 5.75% Series A Cumulative Redeemable Perpetual Preferred Stock,$25.19,0.05,0.199%,,United States,,49036,,
DUKB,Duke Energy Corporation 5.625% Junior Subordinated Debentures due 2078,$24.665,0.0378,0.153%,19180107479.00,United States,2018,17124,Utilities,Power Generation
DUO,Fangdd Network Group Ltd. Class A Ordinary Shares,$2.23,-0.01,-0.446%,8707180.00,China,2019,258736,Finance,Real Estate
DUOL,Duolingo Inc. Class A Common Stock,$306.73,-5.27,-1.689%,14054953534.00,United States,2021,980786,Technology,Computer Software: Prepackaged Software
DUOT,Duos Technologies Group Inc. Common Stock,$10.10,0.62,6.54%,196084430.00,United States,,812869,Technology,Computer Software: Prepackaged Software
DV,DoubleVerify Holdings Inc. Common Stock,$11.84,-0.29,-2.391%,1937360007.00,United States,2021,4354618,Technology,Computer Software: Programming Data Processing
DVA,DaVita Inc. Common Stock,$129.55,0.36,0.279%,9262825000.00,United States,,541992,Health Care,Misc Health and Biotechnology Services
DVAX,Dynavax Technologies Corporation Common Stock,$10.49,0.11,1.06%,1230135886.00,United States,2004,1114584,Health Care,Biotechnology: Pharmaceutical Preparations
DVLT,Datavault AI Inc. Common Stock,$3.28,-0.14,-4.094%,320430987.00,United States,2018,106819862,Technology,Semiconductors
DVN,Devon Energy Corporation Common Stock,$32.93,-0.04,-0.121%,20903964000.00,United States,1985,5762748,Energy,Oil & Gas Production
DVS,Dolly Varden Silver Corporation Common Shares,$4.11,-0.15,-3.521%,358248787.00,,2025,1024362,,
DWSN,Dawson Geophysical Company Common Stock,$2.20,-0.05,-2.222%,68305162.00,United States,,94951,Energy,Oil & Gas Production
DWTX,Dogwood Therapeutics Inc. Common Stock,$6.02,0.14,2.381%,11504991.00,United States,2020,139841,Health Care,Biotechnology: Pharmaceutical Preparations
DX,Dynex Capital Inc. Common Stock,$13.58,0.18,1.343%,1764207092.00,United States,,4458085,Real Estate,Real Estate Investment Trusts
DX^C,Dynex Capital Inc. 6.900% Series C Fixed-to-Floating Rate Cumulative Redeemable Preferred Stock,$25.90,0.04,0.155%,,United States,,8112,,
DXC,DXC Technology Company Common Stock ,$13.43,-0.11,-0.812%,2443733423.00,United States,,1537267,Technology,EDP Services
DXCM,DexCom Inc. Common Stock,$70.63,0.30,0.427%,27697926367.00,United States,2005,2909309,Health Care,Medical/Dental Instruments
DXF,Eason Technology Limited American Depositary Shares (each representing sixty-thousand (60000) Ordinary Shares),$2.96,0.11,3.86%,4108317.00,,,7219,Finance,Finance: Consumer Services
DXLG,Destination XL Group Inc. Common Stock,$1.04,-0.05,-4.587%,56038479.00,United States,,55086,Consumer Discretionary,Clothing/Shoe/Accessory Stores
DXPE,DXP Enterprises Inc. Common Stock,$123.00,0.92,0.754%,1930372332.00,United States,,113242,Industrials,Industrial Machinery/Components
DXR,Daxor Corporation Common Stock,$11.45,-2.33,-16.909%,55418000.00,United States,,16892,Health Care,Medical/Dental Instruments
DXST,Decent Holding Inc Class A Ordinary Shares,$1.34,0.00,0.00%,21775000.00,China,2025,1543,Industrials,Miscellaneous
DXYZ,Destiny Tech100 Inc. Common Stock,$26.03,1.21,4.875%,0.00,,2024,296372,,
DY,Dycom Industries Inc. Common Stock,$284.16,-7.80,-2.672%,8227597340.00,United States,,695355,Industrials,Water Sewer Pipeline Comm & Power Line Construction
DYAI,Dyadic International Inc. Common Stock,$1.18,0.04,3.509%,42701602.00,United States,,101338,Health Care,Biotechnology: Biological Products (No Diagnostic Substances)
DYCQ,DT Cloud Acquisition Corporation Ordinary Shares,$12.06,0.4601,3.966%,0.00,United Kingdom,2024,6351,,
DYCQR,DT Cloud Acquisition Corporation Right,$0.22,0.0001,0.045%,0.00,United Kingdom,2024,31860,,
DYN,Dyne Therapeutics Inc. Common Stock,$24.17,7.05,41.18%,3438514596.00,United States,2020,12671820,Health Care,Biotechnology: Pharmaceutical Preparations
E,ENI S.p.A. Common Stock,$37.06,0.25,0.679%,60861609447.00,Italy,,176162,Energy,Oil & Gas Production
EA,Electronic Arts Inc. Common Stock,$200.50,-0.34,-0.169%,50166564252.00,United States,,1939285,Consumer Discretionary,Services-Misc. Amusement & Recreation
EAD,Allspring Income Opportunities Fund Common Shares,$6.94,0.04,0.58%,0.00,United States,2003,124416,Finance,Finance/Investors Services
EAF,GrafTech International Ltd. Common Stock,$13.59,-3.43,-20.153%,350895295.00,United States,2018,543643,Energy,Industrial Machinery/Components
EAI,Entergy Arkansas LLC First Mortgage Bonds 4.875% Series Due September 1 2066,$21.78,-0.005,-0.023%,9722789523.00,United States,2016,9765,Utilities,Electric Utilities: Central
EARN,Ellington Credit Company Common Shares of Beneficial Interest,$5.35,0.02,0.375%,200941693.00,United States,2013,222859,Real Estate,Real Estate Investment Trusts
EAT,Brinker International Inc. Common Stock,$126.19,-1.12,-0.88%,5615216627.00,United States,,2033596,Consumer Discretionary,Restaurants
EB,Eventbrite Inc. Class A Common Stock,$2.38,0.01,0.422%,229670198.00,United States,2018,310627,Technology,Computer Software: Programming Data Processing
EBAY,eBay Inc. Common Stock,$98.01,0.81,0.833%,44790570000.00,United States,1998,3807262,Real Estate,Real Estate
EBC,Eastern Bankshares Inc. Common Stock,$17.23,-0.43,-2.435%,3643757532.00,United States,2020,4203670,Finance,Savings Institutions
EBF,Ennis Inc. Common Stock,$16.57,-0.38,-2.242%,424684974.00,United States,,217490,Consumer Discretionary,Office Equipment/Supplies/Services
EBMT,Eagle Bancorp Montana Inc. Common Stock,$16.69,-0.20,-1.184%,132721834.00,United States,2010,12889,Finance,Major Banks
EBON,Ebang International Holdings Inc. Class A Ordinary Shares,$4.56,0.08,1.786%,29840357.00,China,2020,23675,Technology,Semiconductors
EBR,Centrais Electricas Brasileiras S A American Depositary Shares (Each representing one Common Share),$10.17,0.16,1.598%,22810077294.00,Brazil,2016,2649869,Utilities,Electric Utilities: Central
EBS,Emergent BioSolutions Inc. Common Stock,$9.69,-0.05,-0.513%,516972149.00,United States,2006,942036,Health Care,Biotechnology: Pharmaceutical Preparations
EC,Ecopetrol S.A. American Depositary Shares,$9.31,0.17,1.86%,19139821383.00,Colombia,,1841317,Energy,Oil & Gas Production
ECAT,BlackRock ESG Capital Allocation Term Trust Common Shares of Beneficial Interest,$16.52,0.13,0.793%,1786390200.00,United States,2021,293094,Finance,Trusts Except Educational Religious and Charitable
ECBK,ECB Bancorp Inc. Common Stock,$15.72,-0.24,-1.504%,139138443.00,United States,2022,2497,Finance,Banks
ECC           ,Eagle Point Credit Company Inc. Common Stock,$6.26,0.02,0.321%,379747400.00,United States,2014,1160716,Finance,Trusts Except Educational Religious and Charitable
ECC^D,Eagle Point Credit Company Inc. 6.75% Series D Preferred Stock,$19.62,-0.07,-0.356%,,United States,,11797,,
ECCC,Eagle Point Credit Company Inc. 6.50% Series C Term Preferred Stock due 2031,$23.3189,0.0189,0.081%,1414583331.00,United States,,1534,Finance,Trusts Except Educational Religious and Charitable
ECCF,Eagle Point Credit Company Inc. 8.00% Series F Term Preferred Stock due 2029,$25.131,-0.049,-0.195%,27359436840.00,United States,,999,,
