Symbol,Name,Last Sale,Net Change,% Change,Market Cap,Country,IPO Year,Volume,Sector,Industry
KCHVU,Kochav Defense Acquisition Corp. Units,$10.40,0.00,0.00%,0.00,United States,2025,52,,
KD,Kyndryl Holdings Inc. Common Stock,$28.90,0.41,1.439%,6680060675.00,United States,2021,1484931,Technology,EDP Services
KDK,Kodiak AI Inc. Common Stock ,$8.70,0.32,3.819%,538179494.00,United States,,600446,Technology,EDP Services
KDKRW,Kodiak AI Inc. Warrants,$2.25,0.20,9.756%,139184352.00,United States,,182066,Technology,EDP Services
KDP,Keurig Dr Pepper Inc. Common Stock,$29.23,2.07,7.622%,39707063205.00,United States,,53680816,Consumer Staples,Beverages (Production/Distribution)
KE,Kimball Electronics Inc. Common Stock,$29.65,-0.05,-0.168%,718079029.00,United States,,144793,Technology,Electrical Products
KELYA,Kelly Services Inc. Class A Common Stock,$12.23,-0.33,-2.627%,431129331.00,United States,,173055,Consumer Discretionary,Professional Services
KELYB,Kelly Services Inc. Class B Common Stock,$12.4289,0.00,0.00%,438140911.00,United States,,140,Consumer Discretionary,Professional Services
KEN,Kenon Holdings Ltd. Ordinary Shares,$51.0085,1.1985,2.406%,2660105619.00,Singapore,2015,12037,Utilities,Electric Utilities: Central
KEP,Korea Electric Power Corporation Common Stock,$15.07,-0.15,-0.986%,19348797281.00,South Korea,1994,514820,Utilities,Electric Utilities: Central
KEQU,Kewaunee Scientific Corporation Common Stock,$44.21,-1.145,-2.525%,126692332.00,United States,,3890,Industrials,Medical Specialities
KEX,Kirby Corporation Common Stock,$88.71,1.84,2.118%,4950018000.00,United States,,805812,Consumer Discretionary,Marine Transportation
KEY,KeyCorp Common Stock,$17.61,-0.21,-1.178%,19309643925.00,United States,,19236537,Finance,Major Banks
KEY^I,KeyCorp Depositary Shares Each Representing a 1/40th Ownership Interest in a Share of Fixed-to-Floating Rate Perpetual Non-Cumulative Preferred Stock Series E,$25.04,-0.025,-0.10%,,United States,,24038,,
KEY^J,KeyCorp Depositary Shares each representing a 1/40th ownership interest in a share of Fixed Rate Perpetual Non-Cumulative Preferred Stock Series F,$22.56,0.09,0.401%,,United States,,23962,,
KEY^K,KeyCorp Depositary Shares each representing a 1/40th ownership interest in a share of Fixed Rate Perpetual Non-Cumulative Preferred Stock Series G,$22.50,-0.04,-0.177%,,United States,,40418,,
KEY^L,KeyCorp Depositary Shares each representing a 1/40th ownership interest in a share of Fixed Rate Perpetual Non-Cumulative Preferred Stock Series H,$25.25,0.11,0.438%,,United States,,16800,,
KEYS,Keysight Technologies Inc. Common Stock,$167.77,-1.70,-1.003%,28832322895.00,United States,2014,1769123,Industrials,Industrial Machinery/Components
KF,Korea Fund Inc. (The) New Common Stock,$35.49,1.14,3.319%,0.00,United States,,18053,Finance,Investment Managers
KFFB,Kentucky First Federal Bancorp Common Stock,$3.70,-0.16,-4.145%,29920846.00,United States,2005,1747,Finance,Savings Institutions
KFII,K&F Growth Acquisition Corp. II Class A Ordinary shares,$10.25,-0.04,-0.389%,0.00,United States,2025,1400,,
KFIIR,K&F Growth Acquisition Corp. II Rights,$0.1852,0.0147,8.622%,0.00,United States,2025,119142,,
KFIIU,K&F Growth Acquisition Corp. II Unit,$10.56,0.1851,1.784%,0.00,United States,2025,420,Finance,Blank Checks
KFRC,Kforce Inc. Common Stock,$27.71,-0.11,-0.395%,515378290.00,United States,1995,215972,Consumer Discretionary,Professional Services
KFS,Kingsway Financial Services Inc. Common Stock (DE),$14.70,0.02,0.136%,424439201.00,Canada,,114333,Finance,Property-Casualty Insurers
KFY,Korn Ferry Common Stock,$70.28,-0.76,-1.07%,3682038496.00,United States,1999,171878,Consumer Discretionary,Diversified Commercial Services
KG,Kestrel Group Ltd.,$26.24,0.04,0.153%,203148584.00,Bermuda,2008,9357,Finance,Property-Casualty Insurers
KGC,Kinross Gold Corporation Common Stock,$22.78,-1.16,-4.845%,27946504000.00,Canada,2001,16424792,Basic Materials,Precious Metals
KGEI,Kolibri Global Energy Inc. Common stock,$4.42,-0.19,-4.121%,156365602.00,United States,,53117,Energy,Oil & Gas Production
KGS,Kodiak Gas Services Inc. Common Stock,$35.99,0.18,0.503%,3158203478.00,United States,2023,888179,Utilities,Natural Gas Distribution
KHC,The Kraft Heinz Company Common Stock,$25.59,0.34,1.347%,30288303912.00,United States,,12261283,Consumer Staples,Packaged Foods
KIDS,OrthoPediatrics Corp. Common Stock,$16.96,-0.07,-0.411%,425248290.00,United States,2017,143615,Health Care,Medical/Dental Instruments
KIDZ,Classover Holdings Inc. Class B Common Stock,$0.8261,0.0721,9.562%,20337332.00,United States,,1682958,Real Estate,Other Consumer Services
KIDZW,Classover Holdings Inc. Warrants,$0.0766,0.0146,23.548%,1885776.00,United States,,69716,Real Estate,Other Consumer Services
KIM,Kimco Realty Corporation (HC) Common Stock,$22.37,0.03,0.134%,15148974670.00,United States,,4216815,Real Estate,Real Estate Investment Trusts
KIM^L,Kimco Realty Corporation Class L Depositary Shares each of which represents a one-one thousandth fractional interest in a share of 5.125% Class L Cumulative Redeemable Preferred Stock liquidation preference $25000.00 per share,$21.18,0.16,0.761%,,United States,,8838,,
KIM^M,Kimco Realty Corporation Class M Depositary Shares each of which represents a one-one thousandth fractional interest in a share of 5.25% Class M Cumulative Redeemable Preferred Stock liquidation preference $25000.00 per share,$21.55,0.03,0.139%,,United States,,11865,,
KIM^N,Kimco Realty Corporation Depositary Shares each representing 1/1000th interest in a share of 7.25% Class N Cumulative Convertible Perpetual Preferred Stock,$60.00,0.00,0.00%,,United States,,10,,
KINS,Kingstone Companies Inc. Common Stock,$14.99,-0.22,-1.446%,211967654.00,United States,,205148,Finance,Property-Casualty Insurers
KIO,KKR Income Opportunities Fund Common Shares,$11.98,0.12,1.012%,0.00,United States,2013,465645,Finance,Investment Managers
KITT,Nauticus Robotics Inc. Common stock,$2.01,0.25,14.205%,9439774.00,United States,2021,88335222,Industrials,Industrial Machinery/Components
KITTW,Nauticus Robotics Inc. Warrant,$0.047,0.0049,11.639%,220731.00,United States,2021,1050649,Industrials,Industrial Machinery/Components
KKR,KKR & Co. Inc. Common Stock,$122.26,1.02,0.841%,108927391119.00,United States,,3059028,Finance,Investment Managers
KKR^D,KKR & Co. Inc. 6.25% Series D Mandatory Convertible Preferred Stock,$50.56,0.14,0.278%,,United States,,184424,,
KKRS,KKR Group Finance Co. IX LLC 4.625% Subordinated Notes due 2061,$18.43,0.08,0.436%,16420185002.00,United States,2021,12749,Finance,Investment Managers
KKRT,KKR & Co. Inc. 6.875% Subordinated Notes due 2065,$25.74,0.17,0.665%,0.00,United States,2025,47256,Finance,Investment Managers
KLAC,KLA Corporation Common Stock,$1215.13,32.31,2.732%,160350219528.00,United States,1980,971274,Technology,Electronic Components
KLAR,Klarna Group plc Ordinary Shares,$39.73,1.32,3.437%,28563847624.00,,2025,2438044,Finance,Finance: Consumer Services
KLC,KinderCare Learning Companies Inc. Common Stock,$6.01,-0.10,-1.637%,709919825.00,United States,2024,500539,Consumer Discretionary,Other Consumer Services
KLIC,Kulicke and Soffa Industries Inc. Common Stock,$40.83,0.02,0.049%,2129101827.00,Singapore,,323422,Technology,Semiconductors
KLRS,Kalaris Therapeutics Inc. Common Stock,$4.86,0.09,1.887%,90893751.00,United States,2020,68559,Health Care,Biotechnology: Biological Products (No Diagnostic Substances)
KLTO,Klotho Neurosciences Inc. Common Stock,$0.5448,-0.0178,-3.164%,33436792.00,United States,2022,637123,Health Care,Biotechnology: Biological Products (No Diagnostic Substances)
KLTOW,Klotho Neurosciences Inc. Warrant,$0.168,-0.002,-1.176%,10310905.00,United States,2022,1891,Health Care,Biotechnology: Biological Products (No Diagnostic Substances)
KLTR,Kaltura Inc. Common Stock,$1.59,-0.02,-1.242%,245641477.00,United States,2021,205843,Technology,Computer Software: Prepackaged Software
KLXE,KLX Energy Services Holdings Inc. Common Stock,$1.86,-0.01,-0.535%,33183250.00,United States,,56879,Energy,Oilfield Services/Equipment
KMB,Kimberly-Clark Corporation Common Stock,$120.62,1.69,1.421%,40019296122.00,United States,,3924459,Consumer Discretionary,Containers/Packaging
KMDA,Kamada Ltd. Ordinary Shares,$7.03,0.16,2.329%,404260368.00,Israel,2013,59498,Health Care,Biotechnology: Pharmaceutical Preparations
KMI,Kinder Morgan Inc. Common Stock,$26.15,0.29,1.121%,58177484199.00,United States,2011,16550196,Utilities,Natural Gas Distribution
KMPB,Kemper Corporation 5.875% Fixed-Rate Reset Junior Subordinated Debentures due 2062,$23.7999,0.0499,0.21%,1493271914.00,United States,2022,6631,Finance,Property-Casualty Insurers
KMPR,Kemper Corporation,$46.49,-1.28,-2.68%,2916911889.00,United States,,1123396,Finance,Property-Casualty Insurers
KMRK,K-Tech Solutions Company Limited Class A Ordinary Shares,$1.22,0.01,0.826%,23790000.00,Hong Kong,2025,43244,Consumer Discretionary,Recreational Games/Products/Toys
KMT,Kennametal Inc. Common Stock,$22.77,0.02,0.088%,1731011308.00,United States,,356962,Industrials,Industrial Machinery/Components
KMTS,Kestra Medical Technologies Ltd. Common Stock,$27.07,1.07,4.115%,1392725865.00,United States,2025,434359,Health Care,Medical/Dental Instruments
KMX,CarMax Inc,$45.08,0.82,1.853%,6619774538.00,United States,,3238692,Consumer Discretionary,Retail-Auto Dealers and Gas Stations
KN,Knowles Corporation Common Stock,$23.57,-0.43,-1.792%,2024370873.00,United States,2014,1002370,Consumer Staples,Consumer Electronics/Appliances
KNDI,Kandi Technologies Group Inc. Ordinary Shares,$1.23,-0.01,-0.806%,107450628.00,China,,66134,Industrials,Auto Manufacturing
KNF,Knife Riv Holding Co. Common Stock,$62.37,-0.48,-0.764%,3534143971.00,United States,2023,726909,Industrials,Mining & Quarrying of Nonmetallic Minerals (No Fuels)
KNOP,KNOT Offshore Partners LP Common Units representing Limited Partner Interests,$9.27,0.20,2.205%,315597901.00,United Kingdom,2013,81068,Consumer Discretionary,Marine Transportation
KNRX,KNOREX LTD. Class A Ordinary Shares,$2.17,0.10,4.831%,66018155.00,,2025,53307,Technology,Computer Software: Programming Data Processing
KNSA,Kiniksa Pharmaceuticals International plc Class A Ordinary Shares,$40.60,1.67,4.29%,3008771321.00,United States,2018,595803,Health Care,Biotechnology: Pharmaceutical Preparations
KNSL,Kinsale Capital Group Inc. Common Stock,$431.86,9.48,2.244%,10046543152.00,United States,,452896,Finance,Property-Casualty Insurers
KNTK,Kinetik Holdings Inc. Class A Common Stock,$39.25,-1.09,-2.702%,6355835592.00,United States,2022,1185794,Utilities,Natural Gas Distribution
KNX,Knight-Swift Transportation Holdings Inc.,$45.10,-0.23,-0.507%,7319820200.00,United States,2017,4112238,Industrials,Trucking Freight/Courier Services
KO,Coca-Cola Company (The) Common Stock,$70.06,0.35,0.502%,301370715681.00,United States,,13800049,Consumer Staples,Beverages (Production/Distribution)
KOD,Kodiak Sciences Inc Common Stock,$18.83,0.14,0.749%,994632404.00,United States,2018,760745,Health Care,Biotechnology: Biological Products (No Diagnostic Substances)
KODK,Eastman Kodak Company Common New,$6.65,-0.07,-1.042%,538650000.00,United States,,810569,Consumer Discretionary,Industrial Machinery/Components
KOF,Coca Cola Femsa S.A.B. de C.V.  American Depositary Shares each representing 10 Units (each Unit consists of 3 Series B Shares and 5 Series L Shares),$88.12,1.15,1.322%,18512533875.00,Mexico,1993,131687,Consumer Staples,Beverages (Production/Distribution)
KOP,Koppers Holdings Inc. Common Stock,$29.41,0.27,0.927%,579833649.00,United States,2006,152016,Basic Materials,Forest Products
KOPN,Kopin Corporation Common Stock,$3.74,-0.05,-1.319%,608893886.00,United States,1992,4278389,Technology,Semiconductors
KORE,KORE Group Holdings Inc. Common Stock,$3.71,0.26,7.536%,64899301.00,United States,,62450,Telecommunications,Telecommunications Equipment
KOS,Kosmos Energy Ltd. Common Shares (DE),$1.57,-0.10,-5.988%,750858736.00,Bermuda,2011,13050645,Energy,Oil & Gas Production
KOSS,Koss Corporation Common Stock,$5.08,-0.11,-2.119%,48038705.00,United States,,54601,Consumer Staples,Consumer Electronics/Appliances
KOYN,CSLM Digital Asset Acquisition Corp III Class A Ordinary Shares,$9.97,-0.03,-0.30%,0.00,United States,2025,385787,,
KOYNU,CSLM Digital Asset Acquisition Corp III Units,$10.22,0.00,0.00%,0.00,United States,2025,3761,,
KOYNW,CSLM Digital Asset Acquisition Corp III Warrants,$0.50,-0.055,-9.91%,0.00,United States,2025,300,,
KPLT,Katapult Holdings Inc. Common Stock,$12.33,-0.22,-1.753%,56342502.00,United States,2019,44973,Consumer Discretionary,Diversified Commercial Services
KPLTW,Katapult Holdings Inc. Warrant,$0.0071,0.0002,2.899%,32444.00,United States,2019,2933,Consumer Discretionary,Diversified Commercial Services
KPRX,Kiora Pharmaceuticals Inc.  Common Stock,$2.53,-0.03,-1.172%,8686732.00,United States,,30930,Health Care,Biotechnology: Pharmaceutical Preparations
KPTI,Karyopharm Therapeutics Inc. Common Stock,$6.42,0.08,1.262%,55669605.00,United States,2013,128757,Health Care,Biotechnology: Pharmaceutical Preparations
KR,Kroger Company (The) Common Stock,$68.03,0.92,1.371%,45081998762.00,United States,,4610978,Consumer Staples,Food Chains
KRC,Kilroy Realty Corporation Common Stock,$41.25,0.36,0.88%,4879641030.00,United States,1997,1429142,Real Estate,Real Estate Investment Trusts
KREF,KKR Real Estate Finance Trust Inc. Common Stock,$8.74,0.03,0.344%,574009394.00,United States,2017,625866,Real Estate,Real Estate Investment Trusts
KREF^A,KKR Real Estate Finance Trust Inc. 6.50% Series A Cumulative Redeemable Preferred Stock,$19.49,0.08,0.412%,,United States,,6765,,
KRG,Kite Realty Group Trust Common Stock,$22.99,0.08,0.349%,5054539857.00,United States,2004,1572477,Real Estate,Real Estate Investment Trusts
KRKR,36Kr Holdings Inc. American Depositary Shares,$5.87,0.27,4.821%,231368650.00,China,2019,3995,Real Estate,Real Estate
KRMD,KORU Medical Systems Inc. Common Stock (DE),$4.13,-0.11,-2.594%,190950372.00,United States,,70782,Health Care,Medical/Dental Instruments
KRMN,Karman Holdings Inc. Common Stock,$83.87,-0.28,-0.333%,11097882623.00,United States,2025,1155205,Industrials,Military/Government/Technical
KRNT,Kornit Digital Ltd. Ordinary Shares,$15.18,0.97,6.826%,688071496.00,Israel,2015,580770,Industrials,Industrial Machinery/Components
KRNY,Kearny Financial Corp Common Stock,$6.54,-0.10,-1.506%,423429180.00,United States,2005,362741,Finance,Savings Institutions
KRO,Kronos Worldwide Inc Common Stock,$4.95,0.00,0.00%,569512924.00,United States,,309087,Basic Materials,Major Chemicals
KROS,Keros Therapeutics Inc. Common Stock,$15.03,-0.01,-0.066%,610449672.00,United States,2020,1194570,Health Care,Biotechnology: Pharmaceutical Preparations
KRP,Kimbell Royalty Partners Common Units Representing Limited Partner Interests,$13.33,-0.03,-0.225%,1438147413.00,United States,2017,394054,Energy,Oil & Gas Production
KRRO,Korro Bio Inc. Common Stock,$39.58,1.49,3.912%,371691941.00,United States,2019,116447,Health Care,Biotechnology: Pharmaceutical Preparations
KRT,Karat Packaging Inc. Common Stock,$24.96,-0.03,-0.12%,501515165.00,United States,2021,112787,Industrials,Plastic Products
KRUS,Kura Sushi USA Inc. Class A Common Stock,$63.78,-0.70,-1.086%,771351429.00,United States,2019,369791,Consumer Discretionary,Restaurants
KRYS,Krystal Biotech Inc. Common Stock,$189.93,3.80,2.042%,5497140381.00,United States,2017,187724,Health Care,Biotechnology: Biological Products (No Diagnostic Substances)
KSCP,Knightscope Inc. Class A Common Stock,$5.81,-0.09,-1.525%,59164038.00,United States,2022,619812,Telecommunications,Telecommunications Equipment
KSPI,Joint Stock Company Kaspi.kz American Depository Shares,$76.80,1.70,2.264%,14540810112.00,Kazakhstan,2024,628161,,
KSS,Kohl's Corporation Common Stock,$16.37,-0.01,-0.061%,1834662561.00,United States,1992,3966700,Consumer Discretionary,Department/Specialty Retail Stores
KT,KT Corporation Common Stock,$18.84,0.23,1.236%,9262985405.00,South Korea,,929659,Telecommunications,Telecommunications Equipment
KTB,Kontoor Brands Inc. Common Stock ,$86.02,1.11,1.307%,4780495609.00,United States,2019,322139,Industrials,Garments and Clothing
KTCC,Key Tronic Corporation Common Stock,$3.28,0.03,0.923%,35337979.00,United States,1983,90997,Technology,Electrical Products
KTF,DWS Municipal Income Trust,$9.19,-0.04,-0.433%,363013620.00,United States,1988,138478,Finance,Finance Companies
KTH,Structures Products Cp 8% CorTS Issued by Peco Energy Cap Tr II Preferred Stock,$29.47,0.1155,0.393%,0.00,United States,,416,Finance,Finance: Consumer Services
KTN,Structured Products Corp 8.205% CorTS 8.205% Corporate Backed Trust Securities (CorTS),$26.64,0.32,1.216%,0.00,United States,,958,Finance,Finance: Consumer Services
KTOS,Kratos Defense & Security Solutions Inc. Common Stock,$90.68,-0.50,-0.548%,15306285260.00,United States,,2769859,Industrials,Military/Government/Technical
KTTA,Pasithea Therapeutics Corp. Common Stock,$0.7083,-0.01,-1.392%,5272286.00,United States,2021,32909,Health Care,Biotechnology: Pharmaceutical Preparations
KTTAW,Pasithea Therapeutics Corp. Warrant,$0.0122,0.0001,0.826%,90812.00,United States,2021,5000,Health Care,Biotechnology: Pharmaceutical Preparations
KULR,KULR Technology Group Inc. Common Stock,$4.09,-0.09,-2.153%,168133941.00,United States,,1679416,Technology,Electrical Products
KURA,Kura Oncology Inc. Common Stock,$11.04,1.34,13.814%,958240922.00,United States,,4587407,Health Care,Biotechnology: Pharmaceutical Preparations
KVAC,Keen Vision Acquisition Corporation Ordinary Shares,$11.57,0.00,0.00%,0.00,United States,2023,12,,
KVACW,Keen Vision Acquisition Corporation Warrant,$0.0636,0.0034,5.648%,0.00,United States,2023,10681,,
KVHI,KVH Industries Inc. Common Stock,$5.79,0.165,2.933%,112932584.00,United States,1996,48826,Technology,Radio And Television Broadcasting And Communications Equipment
KVUE,Kenvue Inc. Common Stock,$15.08,0.08,0.533%,28939574394.00,United States,2023,18913813,Consumer Discretionary,Specialty Chemicals
KVYO,Klaviyo Inc. Series A Common Stock,$26.15,-0.11,-0.419%,7844591197.00,United States,2023,1436013,Technology,Computer Software: Prepackaged Software
KW,Kennedy-Wilson Holdings Inc. Common Stock,$7.96,-0.15,-1.85%,1097682368.00,United States,,472330,Finance,Real Estate
KWM,K Wave Media Ltd. Ordinary Shares,$2.03,-0.04,-1.932%,128218860.00,Cayman Islands,,69814,Consumer Discretionary,Movies/Entertainment
KWMWW,K Wave Media Ltd. Warrant,$0.12,-0.01,-7.692%,7579440.00,Cayman Islands,,2556,Consumer Discretionary,Movies/Entertainment
KWR,Quaker Houghton Common Stock,$133.15,-0.59,-0.441%,2316093520.00,United States,,94141,Industrials,Major Chemicals
KXIN,Kaixin Holdings Ordinary Shares,$0.879,0.049,5.904%,9627973.00,China,2017,200874,Consumer Discretionary,Retail-Auto Dealers and Gas Stations
KYIV,Kyivstar Group Ltd. Common Shares,$13.21,-0.12,-0.90%,3049707139.00,United Arab Emirates,,348937,Telecommunications,Telecommunications Equipment
KYIVW,Kyivstar Group Ltd. Warrant,$3.69,-0.24,-6.107%,851886400.00,United Arab Emirates,,30681,Telecommunications,Telecommunications Equipment
KYMR,Kymera Therapeutics Inc. Common Stock,$60.85,2.29,3.911%,4350628777.00,United States,2020,532211,Health Care,Biotechnology: Biological Products (No Diagnostic Substances)
KYN,Kayne Anderson Energy Infrastructure Fund Inc.,$11.58,-0.02,-0.172%,1576403117.00,United States,2004,441091,Finance,Finance/Investors Services
KYTX,Kyverna Therapeutics Inc. Common Stock,$7.81,0.37,4.973%,337748659.00,United States,2024,1200688,Health Care,Biotechnology: Biological Products (No Diagnostic Substances)
KZIA,Kazia Therapeutics Limited American Depositary Shares,$7.30,0.32,4.585%,9925263.00,Australia,,946860,Health Care,Biotechnology: Pharmaceutical Preparations
KZR,Kezar Life Sciences Inc. Common Stock,$6.19,0.03,0.487%,45330026.00,United States,2018,70023,Health Care,Biotechnology: Pharmaceutical Preparations
L,Loews Corporation Common Stock,$100.06,0.01,0.01%,20755085084.00,United States,,475805,Finance,Property-Casualty Insurers
LAB,Standard BioTools Inc. Common Stock,$1.32,-0.10,-7.042%,504233535.00,United States,2011,1526618,Industrials,Biotechnology: Laboratory Analytical Instruments
LAC,Lithium Americas Corp. Common Shares,$6.01,-0.71,-10.565%,1452393464.00,Canada,2023,32440286,Basic Materials,Metal Mining
LAD,Lithia Motors Inc. Common Stock,$321.76,-9.84,-2.967%,7802689653.00,United States,,555501,Consumer Discretionary,Retail-Auto Dealers and Gas Stations
LADR,Ladder Capital Corp Class A Common Stock,$10.93,-0.08,-0.727%,1393148468.00,United States,2014,954154,Real Estate,Real Estate Investment Trusts
LAES,SEALSQ Corp Ordinary Shares,$6.81,-0.20,-2.853%,711705616.00,Switzerland,,42735848,Technology,Semiconductors
LAFAU,LaFayette Acquisition Corp. Unit,$10.02,0.01,0.10%,0.00,France,2025,47751,,
LAKE,Lakeland Industries Inc. Common Stock,$16.76,-0.04,-0.238%,160403558.00,United States,1986,70284,Health Care,Industrial Specialties
LAMR,Lamar Advertising Company Class A Common Stock,$120.02,-0.17,-0.141%,12148267054.00,United States,1996,335292,Real Estate,Real Estate Investment Trusts
LAND,Gladstone Land Corporation Common Stock,$9.19,0.03,0.328%,332537007.00,United States,2013,351528,Real Estate,Real Estate Investment Trusts
LANDM,Gladstone Land Corporation 5.00% Series D Cumulative Term Preferred Stock,$24.90,0.04,0.161%,900997984.00,United States,,2074,Real Estate,Real Estate Investment Trusts
LANDO,Gladstone Land Corporation 6.00% Series B Cumulative Redeemable Preferred Stock,$19.62,0.07,0.358%,709942990.00,United States,,15681,Real Estate,Real Estate Investment Trusts
LANDP,Gladstone Land Corporation 6.00% Series C Cumulative Redeemable Preferred Stock,$19.45,0.07,0.361%,703791598.00,United States,,34104,Real Estate,Real Estate Investment Trusts
LANV,Lanvin Group Holdings Limited Ordinary Shares,$2.07,-0.16,-7.175%,289335914.00,Cayman Islands,2022,30562,Consumer Discretionary,Apparel
LAR,Lithium Argentina AG Common Shares,$4.53,0.05,1.116%,735219000.00,Canada,2023,4409227,Basic Materials,Metal Mining
LARK,Landmark Bancorp Inc. Common Stock,$25.68,-0.42,-1.609%,148515452.00,United States,,6228,Finance,Major Banks
LASE,Laser Photonics Corporation Common Stock,$3.81,-0.15,-3.788%,54392132.00,United States,2022,320309,Miscellaneous,Industrial Machinery/Components
LASR,nLIGHT Inc. Common Stock,$33.53,0.93,2.853%,1673128927.00,United States,2018,674659,Technology,Semiconductors
LATAU,Galata Acquisition Corp. II Units,$10.09,0.00,0.00%,0.00,United States,2025,223156,,
LAUR,Laureate Education Inc. Common Stock,$29.91,0.07,0.235%,4407629932.00,United States,2017,887597,Real Estate,Other Consumer Services
LAW,CS Disco Inc. Common Stock,$6.89,-0.25,-3.501%,425401319.00,United States,2021,145927,Technology,Computer Software: Prepackaged Software
LAZ,Lazard Inc. Common Stock,$50.28,1.07,2.174%,5669879055.00,Bermuda,2005,774379,Finance,Investment Managers
LAZR,Luminar Technologies Inc.  Class A Common Stock,$2.32,0.10,4.505%,159533543.00,United States,2019,10292691,Consumer Discretionary,Auto Parts:O.E.M.
LB,LandBridge Company LLC Class A Shares Representing Limited Liability Company Interests,$59.62,0.09,0.151%,4563942002.00,,2024,434156,Energy,Oil & Gas Production
LBGJ,Li Bang International Corporation Inc. Ordinary Shares,$0.65,0.01,1.563%,12038000.00,China,2024,75196,Industrials,Industrial Machinery/Components
LBRDA,Liberty Broadband Corporation Class A Common Stock,$56.37,0.28,0.499%,8088485697.00,United States,,31820,Telecommunications,Cable & Other Pay Television Services
LBRDK,Liberty Broadband Corporation Class C Common Stock,$56.52,0.18,0.319%,8110009075.00,United States,,481783,Telecommunications,Cable & Other Pay Television Services
LBRDP,Liberty Broadband Corporation Series A Cumulative Redeemable Preferred Stock,$24.68,0.005,0.02%,3541313234.00,United States,,980,Telecommunications,Cable & Other Pay Television Services
LBRT,Liberty Energy Inc. Class A common stock,$16.88,0.48,2.927%,2734002150.00,United States,2018,4977023,Energy,Oilfield Services/Equipment
LBRX,LB Pharmaceuticals Inc Common Stock,$16.70,0.73,4.571%,335672288.00,United States,2025,77023,Health Care,Biotechnology: Pharmaceutical Preparations
LBTYA,Liberty Global Ltd. Class A Common Shares,$10.93,-0.15,-1.354%,3724208662.00,United Kingdom,,1515831,Telecommunications,Cable & Other Pay Television Services
LBTYB,Liberty Global Ltd. Class B Common Shares,$11.50,0.00,0.00%,3918426315.00,United Kingdom,,28,Telecommunications,Cable & Other Pay Television Services
LBTYK,Liberty Global Ltd. Class C Common Shares,$11.06,-0.09,-0.807%,3768503916.00,United Kingdom,,704559,Telecommunications,Cable & Other Pay Television Services
LC,LendingClub Corporation Common Stock,$18.33,-0.10,-0.543%,2103186895.00,United States,2014,1736454,Finance,Finance: Consumer Services
LCCC,Lakeshore Acquisition III Corp. Ordinary Shares,$10.12,-0.02,-0.197%,0.00,United States,2025,35072,Finance,Blank Checks
LCCCR,Lakeshore Acquisition III Corp. Rights,$0.28,0.00,0.00%,0.00,United States,2025,50,Finance,Blank Checks
LCCCU,Lakeshore Acquisition III Corp. Unit,$10.34,-0.03,-0.289%,0.00,United States,2025,990,Finance,Blank Checks
LCFY,Locafy Limited Ordinary Share,$5.00,-0.10,-1.961%,6910925.00,Australia,2022,13803,Technology,Computer Software: Programming Data Processing
LCFYW,Locafy Limited Warrant,$6.99,0.00,0.00%,9661473.00,Australia,2022,792,Technology,Computer Software: Programming Data Processing
LCID,Lucid Group Inc. Common Stock,$18.10,-0.38,-2.056%,5561215787.00,United States,,7136615,Industrials,Auto Manufacturing
LCII,LCI Industries,$92.06,0.02,0.022%,2231928693.00,United States,1995,205795,Consumer Discretionary,Auto Parts:O.E.M.
LCNB,LCNB Corporation Common Stock,$15.27,-0.33,-2.115%,216465856.00,United States,,25994,Finance,Major Banks
LCTX,Lineage Cell Therapeutics Inc. Common Stock,$1.75,0.05,2.941%,399623508.00,United States,,2004114,Health Care,Biotechnology: Biological Products (No Diagnostic Substances)
