Symbol,Name,Last Sale,Net Change,% Change,Market Cap,Country,IPO Year,Volume,Sector,Industry
PSIX,Power Solutions International Inc. Common Stock,$82.07,-1.49,-1.783%,1890059461.00,United States,,493737,Industrials,Industrial Machinery/Components
PSKY,Paramount Skydance Corporation Class B Common Stock,$16.565,-0.155,-0.927%,11168535203.00,United States,,3798318,Industrials,Broadcasting
PSMT,PriceSmart Inc. Common Stock,$122.22,-0.93,-0.755%,3758740558.00,United States,,129951,Consumer Discretionary,Department/Specialty Retail Stores
PSN,Parsons Corporation Common Stock,$83.93,-0.23,-0.273%,8963206572.00,United States,2019,775259,Technology,EDP Services
PSNL,Personalis Inc. Common Stock,$9.68,0.00,0.00%,858393960.00,United States,2019,758329,Health Care,Medical Specialities
PSNY,Polestar Automotive Holding UK PLC Class A ADS,$0.8813,0.0107,1.229%,1859855484.00,Sweden,,3042251,Industrials,Auto Manufacturing
PSNYW,Polestar Automotive Holding UK PLC Class C-1 ADS (ADW),$0.28,0.0006,0.215%,590899280.00,Sweden,,390366,Industrials,Auto Manufacturing
PSO,Pearson Plc Common Stock,$14.77,-0.17,-1.138%,9479628597.00,United Kingdom,,804612,Consumer Discretionary,Books
PSQH,PSQ Holdings Inc. Class A Common Stock,$2.24,0.06,2.752%,102843339.00,,2021,886459,Consumer Discretionary,Advertising
PSTG,Pure Storage Inc. Class A Common Stock,$95.47,1.68,1.791%,31374935247.00,United States,2015,2100771,Technology,Electronic Components
PSTL,Postal Realty Trust Inc. Class A Common Stock,$15.27,0.02,0.131%,375339746.00,United States,2019,115968,Real Estate,Real Estate Investment Trusts
PSTV,PLUS THERAPEUTICS Inc. Common Stock ,$0.6023,-0.013,-2.113%,59787024.00,United States,,6918841,Health Care,Medical/Dental Instruments
PSX,Phillips 66 Common Stock,$135.42,0.44,0.326%,54726507966.00,United States,,2501817,Energy,Integrated oil Companies
PT,Pintec Technology Holdings Limited American Depositary Shares,$1.00,0.0499,5.252%,15947960.00,China,2018,114395,Technology,Computer Software: Programming Data Processing
PTA,Cohen & Steers Tax-Advantaged Preferred Securities and Income Fund Common Shares of Beneficial Interest,$19.98,0.04,0.201%,1104363671.00,United States,2020,80260,Finance,Trusts Except Educational Religious and Charitable
PTC,PTC Inc. Common Stock,$203.28,-1.53,-0.747%,24351460869.00,United States,,593815,Technology,Computer Software: Prepackaged Software
PTCT,PTC Therapeutics Inc. Common Stock,$67.08,0.68,1.024%,5328707346.00,United States,2013,856218,Health Care,Biotechnology: Pharmaceutical Preparations
PTEN,Patterson-UTI Energy Inc. Common Stock,$6.56,-0.07,-1.056%,2526698813.00,United States,1993,13341151,Energy,Oil & Gas Production
PTGX,Protagonist Therapeutics Inc. Common Stock,$75.25,0.39,0.521%,4681401680.00,United States,2016,938412,Health Care,Biotechnology: Pharmaceutical Preparations
PTHL,Pheton Holdings Ltd Class A Ordinary Shares,$0.62,0.01,1.639%,8835000.00,China,2024,68947,Health Care,Biotechnology: Electromedical & Electrotherapeutic Apparatus
PTHS,Pelthos Therapeutics Inc. Common Stock,$32.00,0.47,1.491%,97348576.00,,2024,3417,Health Care,Biotechnology: Biological Products (No Diagnostic Substances)
PTIX,Protagenic Therapeutics Inc. Common Stock,$2.98,-0.08,-2.614%,1755110.00,United States,,29083,Health Care,Biotechnology: Pharmaceutical Preparations
PTIXW,Protagenic Therapeutics Inc. Warrant,$0.0366,-0.0024,-6.154%,21556.00,United States,,1308,Health Care,Biotechnology: Pharmaceutical Preparations
PTLE,PTL LTD Class A Ordinary Shares,$0.163,0.006,3.822%,6110463.00,Singapore,2024,662563,Energy,Oil Refining/Marketing
PTLO,Portillo's Inc. Class A Common Stock,$5.66,-0.04,-0.702%,426469199.00,United States,2021,2173438,Consumer Discretionary,Restaurants
PTON,Peloton Interactive Inc. Class A Common Stock,$7.72,-0.10,-1.279%,3147934521.00,United States,2019,5848701,Consumer Discretionary,Recreational Games/Products/Toys
PTRN,Pattern Group Inc. Series A Common Stock,$17.26,-0.81,-4.483%,3038099625.00,United States,2025,1428166,Consumer Discretionary,Catalog/Specialty Distribution
PTY,Pimco Corporate & Income Opportunity Fund,$13.74,-0.11,-0.794%,0.00,United States,2002,1596215,Finance,Investment Managers
PUBM,PubMatic Inc. Class A Common Stock,$8.78,0.03,0.343%,401448221.00,United States,2020,510571,Technology,Computer Software: Programming Data Processing
PUK,Prudential Public Limited Company Common Stock,$27.92,0.28,1.013%,35872017266.00,United Kingdom,,2457724,Finance,Life Insurance
PULM,Pulmatrix Inc. Common Stock,$4.93,0.09,1.86%,18005765.00,United States,2014,2925,Health Care,Biotechnology: Pharmaceutical Preparations
PUMP,ProPetro Holding Corp. Common Stock,$7.19,0.88,13.946%,747526469.00,United States,2017,3902031,Energy,Oilfield Services/Equipment
PVBC,Provident Bancorp Inc. (MD) Common Stock,$12.67,0.02,0.158%,225323888.00,United States,2015,21606,Finance,Banks
PVH,PVH Corp. Common Stock,$85.49,-0.04,-0.047%,4113760163.00,United States,,432235,Industrials,Garments and Clothing
PVL,Permianville Royalty Trust Trust Units ,$1.85,0.05,2.778%,61050000.00,United States,2011,107869,Energy,Oil & Gas Production
PVLA,Palvella Therapeutics Inc. Common Stock,$70.43,-2.57,-3.521%,778932206.00,United States,,107017,Health Care,Biotechnology: Pharmaceutical Preparations
PW,Power REIT (MD) Common Stock,$0.814,0.0605,8.029%,2759184.00,United States,1998,36748,Real Estate,Real Estate Investment Trusts
PW^A,Power REIT 7.75% Series A Cumulative Perpetual Preferred Stock,$4.49,0.49,12.25%,,United States,,3400,,
PWP,Perella Weinberg Partners Class A Common Stock,$20.36,0.33,1.648%,1781075759.00,United States,2020,1132078,Finance,Finance: Consumer Services
PWR,Quanta Services Inc. Common Stock,$441.82,0.89,0.202%,65833805736.00,United States,,825288,Industrials,Engineering & Construction
PX,P10 Inc. Class A Common Stock,$10.82,0.27,2.559%,1188861209.00,United States,2021,318223,Finance,Investment Managers
PXED,Phoenix Education Partners Inc. Common Stock,$36.89,-0.74,-1.967%,1313145847.00,,2025,63537,Real Estate,Other Consumer Services
PXLW,Pixelworks Inc.  Common Stock,$6.96,-0.47,-6.326%,37133806.00,United States,2000,323103,Technology,Semiconductors
PXS,Pyxis Tankers Inc. Common Stock,$2.76,-0.07,-2.473%,28940987.00,Greece,,19177,Consumer Discretionary,Marine Transportation
PYPD,PolyPid Ltd. Ordinary Shares,$3.61,0.17,4.942%,36789163.00,Israel,2020,321984,Health Care,Biotechnology: Pharmaceutical Preparations
PYPL,PayPal Holdings Inc. Common Stock,$70.25,0.48,0.688%,67115332951.00,United States,,18821307,Industrials,Diversified Commercial Services
PYT,PPlus Tr GSC-2 Tr Ctf Fltg Rate,$23.4139,-0.1323,-0.562%,0.00,United States,,400,Finance,Finance: Consumer Services
PYXS,Pyxis Oncology Inc. Common Stock,$3.39,-0.07,-2.023%,210241478.00,United States,2021,870718,Health Care,Biotechnology: Pharmaceutical Preparations
PZG,Paramount Gold Nevada Corp. Common Stock,$1.05,0.01,0.962%,81445669.00,United States,2015,423842,Basic Materials,Metal Mining
PZZA,Papa John's International Inc. Common Stock,$51.59,-3.72,-6.726%,1689982228.00,United States,1993,1268931,Consumer Discretionary,Restaurants
QBTS,D-Wave Quantum Inc. Common Shares,$35.04,2.39,7.32%,11984322949.00,,2022,65054302,Technology,EDP Services
QCLS,Q/C Technologies Inc. Common Stock,$4.13,-0.06,-1.432%,7294228.00,United States,2014,132633,Health Care,Biotechnology: In Vitro & In Vivo Diagnostic Substances
QCOM,QUALCOMM Incorporated Common Stock,$187.68,18.74,11.093%,202506720000.00,United States,1991,81799263,Technology,Radio And Television Broadcasting And Communications Equipment
QCRH,QCR Holdings Inc. Common Stock,$75.76,-1.13,-1.47%,1283523420.00,United States,,74512,Finance,Major Banks
QD,Qudian Inc. American Depositary Shares each representing one Class A Ordinary Share,$4.84,0.40,9.009%,799212221.00,China,2017,486926,Finance,Finance: Consumer Services
QDEL,QuidelOrtho Corporation Common Stock,$29.48,-1.03,-3.376%,2001705738.00,United States,,953328,Health Care,Biotechnology: In Vitro & In Vivo Diagnostic Substances
QETA,Quetta Acquisition Corporation Common Stock,$11.30,-0.13,-1.137%,0.00,United States,2023,1511,Finance,Blank Checks
QETAR,Quetta Acquisition Corporation Right,$1.70,-0.27,-13.706%,0.00,United States,2023,3626,Finance,Blank Checks
QETAU,Quetta Acquisition Corporation Unit,$10.84,0.00,0.00%,0.00,United States,2023,40,Finance,Blank Checks
QFIN,Qfin Holdings Inc. American Depositary Shares,$24.86,-2.13,-7.892%,3346156000.00,China,2018,2701074,Finance,Finance: Consumer Services
QGEN,Qiagen N.V. Common Shares,$48.40,-0.92,-1.865%,10460019337.00,Netherlands,,946756,Health Care,Biotechnology: Biological Products (No Diagnostic Substances)
QH,Quhuo Limited American Depository Shares,$6.47,-0.83,-11.37%,6448073.00,China,2020,393072,Real Estate,Real Estate
QIPT,Quipt Home Medical Corp. Common Shares,$2.62,-0.02,-0.758%,113823207.00,United States,,105332,Health Care,Misc Health and Biotechnology Services
QLGN,Qualigen Therapeutics Inc. Common Stock,$2.97,-0.67,-18.407%,5035487.00,United States,2015,1668702,Health Care,Biotechnology: Pharmaceutical Preparations
QLYS,Qualys Inc. Common Stock,$126.07,-1.98,-1.546%,4550607466.00,United States,2012,279154,Technology,Computer Software: Prepackaged Software
QMCO,Quantum Corporation Common Stock,$10.14,-0.32,-3.059%,135057185.00,United States,,1499203,Technology,Electronic Components
QNCX,Quince Therapeutics Inc. Common Stock,$1.79,0.03,1.705%,96147698.00,United States,2019,249312,Health Care,Biotechnology: Biological Products (No Diagnostic Substances)
QNRX,Quoin Pharmaceuticals Ltd. American Depositary Shares,$13.20,0.25,1.931%,7763804.00,Israel,2016,41245,Health Care,Medical/Dental Instruments
QNST,QuinStreet Inc. Common Stock,$14.79,-0.20,-1.334%,853029223.00,United States,2010,440809,Real Estate,Real Estate
QNTM,Quantum Biopharma Ltd. Class B Subordinate Voting Shares,$13.43,-0.47,-3.381%,51246664.00,Canada,,80089,Health Care,Biotechnology: Pharmaceutical Preparations
QQQX,Nuveen NASDAQ 100 Dynamic Overwrite Fund Shares of Beneficial Interest,$28.33,0.25,0.89%,0.00,United States,,107509,Finance,Finance Companies
QRHC,Quest Resource Holding Corporation Common Stock,$1.35,-0.02,-1.46%,27961475.00,United States,,314814,Utilities,Environmental Services
QRVO,Qorvo Inc. Common Stock,$92.13,1.42,1.565%,8536237342.00,United States,,748009,Technology,Semiconductors
QS,QuantumScape Corporation Class A Common Stock,$16.28,-0.54,-3.21%,9789329942.00,United States,2020,35507376,Miscellaneous,Industrial Machinery/Components
QSEA,Quartzsea Acquisition Corporation Ordinary Shares,$10.17,0.00,0.00%,0.00,United States,2025,2258,Finance,Blank Checks
QSG,QuantaSing Group Limited American Depositary Shares,$7.62,-0.03,-0.392%,389481083.00,China,2023,244047,Real Estate,Other Consumer Services
QSI,Quantum-Si Incorporated Class A Common Stock,$2.34,0.05,2.183%,473838763.00,United States,2020,10282659,Industrials,Industrial Machinery/Components
QSIAW,Quantum-Si Incorporated Warrant,$0.4848,0.0022,0.456%,98169672.00,United States,2020,37557,Industrials,Industrial Machinery/Components
QSR,Restaurant Brands International Inc. Common Shares,$67.37,-0.05,-0.074%,30638863968.00,Canada,2014,1152124,Consumer Discretionary,Restaurants
QTRX,Quanterix Corporation Common Stock,$5.68,-0.04,-0.699%,263926397.00,United States,2017,513120,Industrials,Biotechnology: Laboratory Analytical Instruments
QTTB,Q32 Bio Inc. Common Stock,$2.80,-0.17,-5.724%,34153322.00,United States,2018,137599,Health Care,Biotechnology: Pharmaceutical Preparations
QTWO,Q2 Holdings Inc. Common Stock,$62.29,0.03,0.048%,3889537781.00,United States,2014,568375,Technology,Computer Software: Prepackaged Software
QUAD,Quad Graphics Inc Class A Common Stock,$5.94,-0.09,-1.493%,299810422.00,United States,,235469,Consumer Discretionary,Publishing
QUBT,Quantum Computing Inc. Common Stock,$15.72,0.19,1.223%,2513363700.00,United States,,45408022,Technology,Computer Software: Prepackaged Software
QUIK,QuickLogic Corporation Common Stock,$6.72,-0.30,-4.274%,110389091.00,United States,1999,178175,Technology,Semiconductors
QUMS,Quantumsphere Acquisition Corp. Ordinary Shares,$9.97,0.00,0.00%,0.00,United States,2025,143616,,
QUMSR,Quantumsphere Acquisition Corp. Rights,$0.27,-0.0205,-7.057%,0.00,United States,2025,594,,
QUMSU,Quantumsphere Acquisition Corp. Units,$10.22,-0.02,-0.195%,0.00,United States,2025,5123,,
QURE,uniQure N.V. Ordinary Shares,$67.92,6.91,11.326%,3726561886.00,Netherlands,2014,2619195,Health Care,Biotechnology: Pharmaceutical Preparations
QVCC,QVC Inc. 6.250% Senior Secured Notes due 2068,$10.46,0.14,1.357%,0.00,United States,2019,33700,Consumer Discretionary,Catalog/Specialty Distribution
QVCD,QVC Inc. 6.375% Senior Secured Notes due 2067,$10.43,0.09,0.87%,0.00,United States,2018,21760,Consumer Discretionary,Catalog/Specialty Distribution
QVCGA,QVC Group Inc. Series A Common Stock,$10.43,-0.97,-8.509%,84150460.00,United States,,145862,Consumer Discretionary,Catalog/Specialty Distribution
QVCGP,QVC Group Inc. 8.0% Fixed Rate Cumulative Redeemable Preferred Stock,$5.57,-0.18,-3.13%,44939412.00,United States,,91778,Consumer Discretionary,Catalog/Specialty Distribution
QXO,QXO Inc. Common Stock,$18.08,-0.31,-1.686%,12177904340.00,United States,,5773940,Consumer Discretionary,RETAIL: Building Materials
QXO^B,QXO Inc.  Depositary Shares each representing a 1/20th interest in a share of 5.50% Series B Mandatory Convertible Preferred Stock,$53.16,-0.88,-1.628%,,United States,,2397,,
R,Ryder System Inc. Common Stock,$168.26,6.95,4.308%,6793755611.00,United States,,726911,Consumer Discretionary,Rental/Leasing Companies
RA,Brookfield Real Assets Income Fund Inc. Common Stock,$13.22,-0.02,-0.151%,0.00,United States,2016,129602,Finance,Investment Managers
RAAQ,Real Asset Acquisition Corp. Class A Ordinary Share,$10.41,-0.02,-0.192%,0.00,United States,2025,7293,,
RAAQU,Real Asset Acquisition Corp. Unit,$10.67,-0.13,-1.204%,0.00,United States,2025,222,Finance,Blank Checks
RAAQW,Real Asset Acquisition Corp. Warrants,$0.7875,0.0076,0.974%,0.00,United States,2025,26249,,
RAC,Rithm Acquisition Corp. Class A Ordinary Shares,$10.39,-0.01,-0.096%,0.00,,2025,609,,
RAC/WS,Rithm Acquisition Corp.,$0.65,-0.01,-1.515%,,,,2147,,
RACE,Ferrari N.V. Common Shares,$407.46,-0.85,-0.208%,98759015542.00,Italy,2015,445823,Industrials,Auto Manufacturing
RADX,Radiopharm Theranostics Limited American Depositary Shares,$5.275,-0.055,-1.032%,41583695.00,Australia,,60439,Health Care,Biotechnology: Pharmaceutical Preparations
RAIL,FreightCar America Inc. Common Stock,$9.86,0.07,0.715%,188596282.00,United States,2005,98774,Industrials,Railroads
RAIN,Rain Enhancement Technologies Holdco Inc. Class A Common Stock,$5.82,-0.09,-1.523%,44153506.00,United States,,5362,Technology,Industrial Machinery/Components
RAINW,Rain Enhancement Technologies Holdco Inc. Warrants,$0.1661,-0.0139,-7.722%,1260120.00,United States,,14621,Technology,Industrial Machinery/Components
RAL,Ralliant Corporation Common Stock,$43.55,0.14,0.323%,4909791768.00,United States,2025,710212,Industrials,Industrial Machinery/Components
RAMP,LiveRamp Holdings Inc. Common Stock,$28.18,-0.33,-1.157%,1848760679.00,United States,2018,347496,Technology,EDP Services
RAND,Rand Capital Corporation Common Stock,$13.62,0.12,0.889%,40448867.00,United States,,7051,Finance,Finance: Consumer Services
RANG,Range Capital Acquisition Corp. Ordinary Shares,$10.53,0.00,0.00%,0.00,United States,2025,1753,,
RANGR,Range Capital Acquisition Corp. Rights,$0.4995,-0.0005,-0.10%,0.00,United States,2025,121,,
RANI,Rani Therapeutics Holdings Inc. Class A Common Stock,$1.78,-0.04,-2.198%,127926085.00,United States,2021,13880005,Health Care,Biotechnology: Pharmaceutical Preparations
RAPP,Rapport Therapeutics Inc. Common Stock,$26.48,0.55,2.121%,966464922.00,United States,2024,550921,Health Care,Biotechnology: Pharmaceutical Preparations
RAPT,RAPT Therapeutics Inc. Common Stock,$30.10,0.57,1.93%,497787599.00,United States,2019,805416,Health Care,Biotechnology: Pharmaceutical Preparations
RARE,Ultragenyx Pharmaceutical Inc. Common Stock,$35.31,1.78,5.309%,3402882714.00,United States,2014,1745976,Health Care,Biotechnology: Pharmaceutical Preparations
RAVE,Rave Restaurant Group Inc. Common Stock,$2.71,0.12,4.633%,38513344.00,United States,,60345,Consumer Discretionary,Food Distributors
RAY,Raytech Holding Limited Ordinary Shares,$0.296,-0.0236,-7.384%,12905033.00,Hong Kong,2024,740466,Consumer Discretionary,Consumer Electronics/Appliances
RAYA,Erayak Power Solution Group Inc. Class A Ordinary Shares,$4.90,-0.13,-2.584%,4385348.00,China,2022,24022,Consumer Discretionary,Metal Fabrications
RBA,RB Global Inc. Common Stock,$101.43,-0.33,-0.324%,18931821459.00,Canada,,1073077,Real Estate,Real Estate
RBB,RBB Bancorp Common Stock,$19.53,0.13,0.67%,336908651.00,United States,2017,50326,Finance,Major Banks
RBBN,Ribbon Communications Inc. Common Stock,$3.45,-0.095,-2.68%,609268586.00,United States,,1290254,Technology,EDP Services
RBC,RBC Bearings Incorporated Common Stock,$411.08,-1.11,-0.269%,12974752786.00,United States,2022,162876,Industrials,Metal Fabrications
RBCAA,Republic Bancorp Inc. Class A Common Stock,$68.25,-1.45,-2.08%,1332958263.00,United States,1998,23915,Finance,Major Banks
RBKB,Rhinebeck Bancorp Inc. Common Stock,$9.82,-0.255,-2.531%,109054341.00,United States,2019,11793,Finance,Banks
RBLX,Roblox Corporation Class A Common Stock,$128.49,0.78,0.611%,89075261930.00,United States,2021,6452639,Technology,Computer Software: Prepackaged Software
RBNE,Robin Energy Ltd. Common Stock,$1.20,-0.01,-0.826%,2864078.00,Cyprus,,1032666,Consumer Discretionary,Marine Transportation
RBOT,Vicarious Surgical Inc. Class A Common Stock,$5.85,0.00,0.00%,34820622.00,Hong Kong,2020,60637,Health Care,Industrial Specialties
RBRK,Rubrik Inc. Class A Common Stock,$77.79,0.80,1.039%,15360311106.00,United States,2024,2616398,Technology,Computer Software: Prepackaged Software
RC,Ready Capital Corporation Common Stock,$3.14,0.03,0.965%,515987634.00,United States,2013,1637268,Real Estate,Real Estate Investment Trusts
RC^C,Ready Capital Corporation 6.25% Series C Cumulative Convertible Preferred Stock,$15.49,0.10,0.65%,,United States,,833,,
RC^E,Ready Capital Corporation 6.50% Series E Cumulative Redeemable Preferred Stock,$15.01,0.16,1.077%,,United States,,18736,,
RCAT,Red Cat Holdings Inc. Common Stock,$11.47,0.32,2.87%,1144296016.00,United States,,13211447,Technology,Computer Software: Prepackaged Software
RCB,Ready Capital Corporation 6.20% Senior Notes due 2026,$24.46,-0.08,-0.326%,4019445073.00,United States,2019,257,Real Estate,Real Estate Investment Trusts
RCC,Ready Capital Corporation 5.75% Senior Notes due 2026,$24.69,0.00,0.00%,4057240346.00,United States,2021,115,Real Estate,Real Estate Investment Trusts
RCD,Ready Capital Corporation 9.00% Senior Notes due 2029,$23.82,0.095,0.40%,0.00,United States,2024,24131,Real Estate,Real Estate Investment Trusts
RCEL,Avita Medical Inc. Common Stock,$3.79,-0.18,-4.534%,100885760.00,United States,,316938,Health Care,Medical/Dental Instruments
RCG,RENN Fund Inc Common Stock,$2.62,0.0198,0.761%,0.00,United States,,15615,Finance,Investment Managers
RCI,Rogers Communication Inc. Common Stock,$39.74,0.40,1.017%,21468552548.00,Canada,,1155994,Telecommunications,Cable & Other Pay Television Services
RCKT,Rocket Pharmaceuticals Inc. Common Stock,$3.94,0.09,2.338%,425141252.00,United States,2015,1677642,Health Care,Biotechnology: Pharmaceutical Preparations
RCKTW,Rocket Pharmaceuticals Inc. Warrant,$0.0372,0.00,0.00%,4014024.00,United States,,5000,Health Care,Biotechnology: Pharmaceutical Preparations
RCKY,Rocky Brands Inc. Common Stock,$29.37,-0.55,-1.838%,219345175.00,United States,1993,42420,Consumer Discretionary,Shoe Manufacturing
RCL,Royal Caribbean Cruises Ltd. Common Stock,$320.26,3.81,1.204%,86991474392.00,United States,1993,2644572,Consumer Discretionary,Marine Transportation
RCMT,RCM Technologies Inc. Common Stock,$22.68,-0.51,-2.199%,168070367.00,United States,,17837,Consumer Discretionary,Professional Services
RCON,Recon Technology Ltd. Class A Ordinary Shares,$1.78,-0.09,-4.813%,54516818.00,China,2009,51354,Energy,Oilfield Services/Equipment
RCS,PIMCO Strategic Income Fund Inc.,$7.19,0.03,0.419%,0.00,United States,1994,129023,Finance,Investment Managers
RCT,RedCloud Holdings plc Ordinary Shares,$1.69,0.00,0.00%,74743013.00,United Kingdom,2025,213506,Consumer Discretionary,Other Specialty Stores
RCUS,Arcus Biosciences Inc. Common Stock,$18.60,1.29,7.452%,1979616154.00,United States,2018,2050960,Health Care,Biotechnology: Pharmaceutical Preparations
RDAC,Rising Dragon Acquisition Corp. Ordinary Shares,$10.46,-0.01,-0.096%,0.00,China,2024,656,,
RDAG,Republic Digital Acquisition Company Class A Ordinary Shares,$10.31,0.00,0.00%,0.00,United States,2025,6282,Finance,Blank Checks
RDAGW,Republic Digital Acquisition Company Warrants,$0.7306,-0.0194,-2.587%,0.00,United States,2025,5596,Finance,Blank Checks
RDCM,Radcom Ltd. Ordinary Shares,$14.13,-0.30,-2.079%,224887654.00,Israel,1997,21847,Technology,Computer peripheral equipment
RDDT,Reddit Inc. Class A Common Stock,$219.24,5.04,2.353%,41032121122.00,United States,2024,4888247,Technology,EDP Services
RDGT,Ridgetech Inc. Ordinary Shares,$1.84,-0.13,-6.599%,10773217.00,China,,7310,Consumer Staples,Retail-Drug Stores and Proprietary Stores
RDHL,Redhill Biopharma Ltd. American Depositary Shares,$1.57,-0.07,-4.268%,5227875.00,Israel,,89524,Health Care,Biotechnology: Pharmaceutical Preparations
RDI,Reading International Inc Class A Common Stock,$1.44,0.00,0.00%,32712854.00,United States,,16213,Consumer Discretionary,Movies/Entertainment
RDIB,Reading International Inc Class B Common Stock,$11.60,0.00,0.00%,263520216.00,United States,,1270,Consumer Discretionary,Movies/Entertainment
RDN,Radian Group Inc. Common Stock,$33.64,-0.53,-1.551%,4556553003.00,United States,,750479,Finance,Property-Casualty Insurers
RDNT,RadNet Inc. Common Stock,$81.63,-1.78,-2.134%,6278658141.00,United States,,904904,Health Care,Medical Specialities
RDNW,RideNow Group Inc. Class B Common Stock,$3.69,0.10,2.786%,140413437.00,United States,,23890,Technology,EDP Services
RDVT,Red Violet Inc. Common Stock ,$52.56,-1.47,-2.721%,734669909.00,United States,,36600,Technology,Computer Software: Prepackaged Software
RDW,Redwire Corporation Common Stock,$8.24,0.24,3.00%,1186889139.00,United States,2021,4561730,Industrials,Military/Government/Technical
RDWR,Radware Ltd. Ordinary Shares,$26.15,-0.35,-1.321%,1116252864.00,Israel,1999,59387,Real Estate,Real Estate
RDY,Dr. Reddy's Laboratories Ltd Common Stock,$14.47,-0.11,-0.754%,12074569132.00,India,,1646021,Health Care,Biotechnology: Pharmaceutical Preparations
RDZN,Roadzen Inc. Ordinary Shares,$1.40,0.01,0.719%,106430457.00,United States,2022,208018,Finance,Specialty Insurers
RDZNW,Roadzen Inc. Warrants,$0.0895,-0.0038,-4.073%,6803947.00,United States,2022,7100,Finance,Specialty Insurers
REAL,The RealReal Inc. Common Stock,$12.32,0.23,1.902%,1419723240.00,United States,2019,2903914,Consumer Discretionary,Other Specialty Stores
REAX,The Real Brokerage Inc. Common Shares,$3.89,-0.01,-0.256%,814177000.00,Canada,,939615,Finance,Real Estate
REBN,Reborn Coffee Inc. Common Stock,$2.22,-0.01,-0.448%,12009570.00,United States,2022,15060,Consumer Discretionary,Restaurants
RECT,Rectitude Holdings Ltd Ordinary Shares,$3.44,-0.04,-1.149%,49880000.00,Singapore,2024,19372009,Consumer Discretionary,Industrial Machinery/Components
REE,REE Automotive Ltd. Class A Ordinary Shares,$1.19,-0.03,-2.459%,36914909.00,Israel,,250831,Industrials,Auto Manufacturing
REFI,Chicago Atlantic Real Estate Finance Inc. Common Stock,$13.21,0.03,0.228%,278395796.00,United States,2021,97343,Real Estate,Real Estate Investment Trusts
REFR,Research Frontiers Incorporated Common Stock,$2.36,0.36,18.00%,79409802.00,United States,,904061,Miscellaneous,Multi-Sector Companies
REG,Regency Centers Corporation Common Stock,$73.18,0.54,0.743%,13286071519.00,United States,1993,1187401,Real Estate,Real Estate Investment Trusts
REGCO,Regency Centers Corporation 5.875% Series B Cumulative Redeemable Preferred Stock,$23.44,-0.06,-0.255%,4255609680.00,United States,,3528,Real Estate,Real Estate Investment Trusts
REGCP,Regency Centers Corporation 6.25% Series A Cumulative Redeemable Preferred Stock,$24.10,0.0001,0.00%,4375434867.00,United States,,3919,Real Estate,Real Estate Investment Trusts
REGN,Regeneron Pharmaceuticals Inc. Common Stock,$585.31,7.36,1.273%,62035509677.00,United States,1991,1246122,Health Care,Biotechnology: Pharmaceutical Preparations
REI,Ring Energy Inc. Common Stock,$1.00,-0.03,-2.913%,206544770.00,United States,,1934878,Energy,Oil & Gas Production
REKR,Rekor Systems Inc. Common Stock,$2.93,0.09,3.169%,370158720.00,United States,,7124770,Telecommunications,Telecommunications Equipment
RELI,Reliance Global Group Inc. Common Stock,$0.9501,-0.0198,-2.041%,4129186.00,United States,,12932215,Finance,Specialty Insurers
RELIW,Reliance Global Group Inc. Series A Warrants,$0.035,0.0027,8.359%,152112.00,United States,,136755,Finance,Specialty Insurers
RELL,Richardson Electronics Ltd. Common Stock,$10.82,0.09,0.839%,156814498.00,United States,1983,85137,Technology,Electronic Components
RELX,RELX PLC PLC American Depositary Shares (Each representing One Ordinary Share),$46.64,0.07,0.15%,85419739999.00,United Kingdom,2015,1146963,Real Estate,Real Estate
RELY,Remitly Global Inc. Common Stock,$16.95,-0.25,-1.453%,3494975028.00,United States,2021,3488367,Real Estate,Real Estate
RENT,Rent the Runway Inc. Class A Common Stock,$4.50,-0.40,-8.163%,18436640.00,United States,2021,80820,Consumer Discretionary,Other Specialty Stores
REPL,Replimune Group Inc. Common Stock,$9.33,0.53,6.023%,728261043.00,United States,2018,3594273,Health Care,Biotechnology: Biological Products (No Diagnostic Substances)
REPX,Riley Exploration Permian Inc. Common Stock,$26.41,-0.27,-1.012%,582135664.00,United States,1999,126802,Energy,Oil & Gas Production
